issue,subject,company,domain,request_type,risk_level,action,response
I can't log in to my account. It says invalid password.,Login Issue,HackerRank,ERROR,System Error,HIGH,ESCALATE,I encountered a technical issue while processing your request. Escalating to support. (Reason: Model Failure) (Ticket ID: TKT-1EF27925)
What is the maximum token limit for Claude 3.5 Sonnet?,Token limit,Claude,ERROR,System Error,HIGH,ESCALATE,I encountered a technical issue while processing your request. Escalating to support. (Reason: Model Failure) (Ticket ID: TKT-431EA871)
My credit card was charged twice for the same transaction!,Double charge,Visa,ERROR,System Error,HIGH,ESCALATE,I encountered a technical issue while processing your request. Escalating to support. (Reason: Model Failure) (Ticket ID: TKT-3AE2214E)
My assessment link says expired but I need to take it today,Assessment problem,nan,HackerRank,Assessments,LOW,RESPOND,"If your assessment link has expired, you must request a new link directly from the company that invited you. HackerRank cannot extend deadlines."
Can I use Claude API for free?,API billing,nan,ERROR,System Error,HIGH,ESCALATE,I encountered a technical issue while processing your request. Escalating to support. (Reason: Model Failure) (Ticket ID: TKT-B3CC88C2)
I lost my card and someone used it to buy things,Stolen card,Visa,Visa,Fraud,HIGH,ESCALATE,This issue is highly sensitive and has been escalated to the Fraud Protection Team for immediate review. (Ticket ID: TKT-DC991238)
